{"$schema":"https://json-schema.org/draft/2020-12/schema","title":"Public-safe lean progress","type":"object","additionalProperties":false,"required":["schema_version","run_id","stage","status","case_count","calls_completed","calls_maximum","role_counts","private_content_excluded","expert_holdout_unopened","automated_holdout_unopened","updated_at"],"properties":{"schema_version":{"const":"3.1.0-lean.1"},"run_id":{"type":"string","pattern":"^LRUN-[0-9a-f]{16}$"},"stage":{"enum":["D0","D1","D2","validation"]},"status":{"enum":["planned","running","complete","incomplete","failed","paused_resource_limit"]},"case_count":{"type":"integer","minimum":0},"calls_completed":{"type":"integer","minimum":0},"calls_maximum":{"type":"integer","minimum":0},"role_counts":{"type":"object","additionalProperties":{"type":"integer","minimum":0}},"private_content_excluded":{"const":true},"expert_holdout_unopened":{"const":true},"automated_holdout_unopened":{"const":true},"updated_at":{"type":"string","format":"date-time"}}}
